BookCode,BookTitle,BookDescription,CountPage,PrintType,Authors,SalesAvailable,PublicDomain,PreviewAvaliable,idBookDimension,BookCategory
9788580414837,"Mais uma chance","Grant Carter encontrou na doce e linda Harlow algo que não esperava ter: uma mulher com quem desejasse passar toda a sua vida. Para ficar com ela, precisou provar que não era apenas um playboy sedutor. Mas quando ela lhe contou um doloroso segredo, ele se deixou levar por seus medos mais profundos e pode ter destruído sua única chance de viver um amor verdadeiro.",8,0,"Abbi Glines",1,1,0,4997,1
9788580414615,Eva,"Num suspense emocionante, William P. Young, autor de A cabana faz em seu novo livro uma abordagem totalmente nova e inspiradora da história da Criação. Fruto de mais de 40 anos de pesquisas, fiel aos textos bíblicos originais e com uma narrativa primorosa, Eva apresenta um ponto de vista humano e reconfortante de um dos episódios mais tristes das Escrituras- o momento em que o homem vira a face para Deus e é expulso do Paraíso. Com sua capacidade única de emocionar e fazer refletir, o autor trata de temas como perda, culpa, perdão e redenção, e cria uma alegoria sobre a importância de nossas escolhas, a verdade de nossas origens e o poder transformador do amor de Deus.",40,0,"William P. Young",1,1,0,4998,1
9788580414486,"Perdido em Marte","Há seis dias, o astronauta Mark Watney se tornou a décima sétima pessoa a pisar em Marte. E, provavelmente, será a primeira a morrer no planeta vermelho. Depois de uma forte tempestade de areia, a missão Ares 3 é abortada e a tripulação vai embora, certa de que Mark morreu em um terrível acidente. Munido de nada além de curiosidade e de suas habilidades de engenheiro e botânico - e um senso de humor inabalável -, ele embarca numa luta obstinada pela sobrevivência. Para isso, será o primeiro homem a plantar batatas em Marte e, usando uma genial mistura de cálculos e fita adesiva, vai elaborar um plano para entrar em contato com a Nasa e, quem sabe, sair vivo de lá.",36,0,"Andy Weir",1,1,0,4999,1
9788580414400,"O conde enfeitiçado","Depois de anos colecionando conquistas amorosas sem nunca entregar seu coração, o libertino mais famoso de Londres enfim se apaixonou. Infelizmente, conheceu a mulher de seus sonhos no jantar de ensaio do casamento dela. Em 36 horas, Francesca se tornaria esposa do primo dele. Mas isso foi no passado. Quatro anos depois, Francesca está livre, embora só pense em Michael como amigo e confidente. E ele não ousa falar com ela sobre seus sentimentos – a culpa por amar a viúva de John, praticamente um irmão para ele, não permite. No sexto livro da série <em>Os Bridgertons</em>, Julia Quinn mostra, em sua já consagrada escrita cheia de delicadezas, que a vida sempre nos reserva um final feliz. Basta que estejamos atentos para e",40,0,"Julia Quinn",1,1,0,5000,1
9788580414189,"Feitiço da sombra","Segundo livro da trilogia Primos O’Dwyer, Feitiço da sombra é uma emocionante história sobre os maiores poderes mágicos que existem: o amor, a amizade e a família. Depois de um breve encontro com a morte, Connor e a melhor amiga de sua irmã se entregam um ao outro. Muitas mulheres passaram pela cama de Connor, mas nenhuma havia descoberto o caminho para seu coração. Meara tem olhos escuros, pele morena – herança do lado cigano de sua família – e corpo de deusa. Os rumos dela e os de Connor se cruzam diariamente. Ele leva turistas em caminhadas para observar falcões. Ela os guia em cavalgadas pelo campo. Eles se dão bem desde a infância e, depois do tórrido encontro, o rapaz tem esperança de que esse relacionamento evolua. Para frustração dele, no entanto, Meara se contenta apenas com o prazer do momento, temendo se perder – e perder a amizade dele. Essa mudança em sua relação pode abalar o círculo e permitir que uma perigosa ameaça ressurja aos poucos, como uma névoa. Para detê-la, Connor precisará novamente da família e dos amigos para despertar a força e a fúria que correm em seu sangue. Quem sabe pela última vez.",88,0,"Nora Roberts",1,1,0,5001,1
9788580414097,"As espiãs do dia D","Segunda Guerra Mundial. Na fúria expansionista do Terceiro Reich, a França é tomada pelas tropas de Hitler. Os alemães ignoram quando e onde, mas estão cientes de que as forças aliadas planejam libertar a Europa. Para a oficial inglesa Felicity Clairet, nunca houve tanto em jogo. Ela sabe que a capacidade de Hitler repelir um ataque depende de suas linhas de comunicação. Assim, a dias da invasão pelos Aliados, não há meta mais importante que inutilizar a maior central telefônica da Europa, alojada num palácio na cidade de Sainte-Cécile. Porém, além de altamente vigiado, esse ponto estratégico é à prova de bombardeios. Quando Felicity e o marido, um dos líderes da Resistência francesa, tentam um ataque direto, Michel é baleado e seu grupo, dizimado.",48,0,"Ken Follett",1,1,0,5002,1
9788580413847,"Bruxa da noite",NULL,20,0,"Nora Roberts",1,1,0,5003,1
9788580413625,"Para Sir Phillip, com amor",NULL,88,0,"Julia Quinn",1,1,0,5004,1
9788580413533,"A música do silêncio",NULL,44,0,"Patrick Rothfuss",1,1,0,5005,1
9788580413304,"Um lugar chamado liberdade",NULL,0,0,"Ken Follett",1,1,0,5006,1
9788580413120,"Amor sem limites",NULL,92,0,"Abbi Glines",1,1,0,5007,1
9788580412994,"O doador de memórias",NULL,92,0,"Lois Lowry",1,1,0,5008,1
9788580412734,"Mar de rosas",NULL,88,0,"Nora Roberts",1,1,0,5009,1
9788580412536,"Seis anos depois",NULL,72,0,"Harlan Coben",1,1,0,5010,1
9788580412451,"Tentação sem limites",NULL,8,0,"Abbi Glines",1,1,0,5011,1
9788580411614,"Armadilhas da mente","Camille é uma mulher bela, rica e brilhante, capaz de deixar as pessoas impressionadas com sua habilidade de debater e argumentar. Mas seus diplomas e seu intelecto não foram suficientes para evitar que se tornasse vítima de suas própria",56,0,"Augusto Cury",1,1,0,5012,1
9788580411522,Inferno,NULL,48,0,"Dan Brown",1,1,0,5013,1
9788580411522,Inferno,NULL,48,0,"Dan Brown",1,1,0,5014,1
9788580411263,"O inferno de Gabriel",NULL,12,0,"Sylvain Reynard",1,1,0,5015,1
9788580411089,"A travessia",NULL,40,0,"William P. Young",1,1,0,5016,1
9788580411089,"A travessia",NULL,40,0,"William P. Young",1,1,0,5017,1
9788580410891,"Inverno do mundo",NULL,80,0,"Ken Follett",1,1,0,5018,1
9788580410891,"Inverno do mundo",NULL,80,0,"Ken Follett",1,1,0,5019,1
9788579802218,"Quatro - Histórias da série Divergente","Veronica Roth presenteia os fãs da trilogia <em>Divergente</em>, bestseller do <em>The New York Times</em> e sucesso de bilheteria nos cinemas, com um vislumbre da história de Quatro, o misterioso treinador dos iniciandos da Audácia, por quem a jovem Beatrice Prior se apaixona. As histórias que compõem a coleção se passam antes de Quatro conhecer Tris, antes mesmo de ganhar o nome baseado no número de medos que possui. Dois anos antes de Beatrice Prior trocar a Abnegação pela Audácia na Cerimônia de Escolha, o filho do líder da Abnegação fez o mesmo. Para o menino inseguro, maltratado pelo pai e órfão de mãe, então com dezesseis anos, a transferência era uma chance de deixar para trás uma vida de abusos e começar de novo. ",72,0,"Veronica Roth",1,1,0,5020,1
9788579802218,"Quatro - Histórias da série Divergente","Veronica Roth presenteia os fãs da trilogia <em>Divergente</em>, bestseller do <em>The New York Times</em> e sucesso de bilheteria nos cinemas, com um vislumbre da história de Quatro, o misterioso treinador dos iniciandos da Audácia, por quem a jovem Beatrice Prior se apaixona. As histórias que compõem a coleção se passam antes de Quatro conhecer Tris, antes mesmo de ganhar o nome baseado no número de medos que possui. Dois anos antes de Beatrice Prior trocar a Abnegação pela Audácia na Cerimônia de Escolha, o filho do líder da Abnegação fez o mesmo. Para o menino inseguro, maltratado pelo pai e órfão de mãe, então com dezesseis anos, a transferência era uma chance de deixar para trás uma vida de abusos e começar de novo. ",72,0,"Veronica Roth",1,1,0,5021,4
9788579801860,Convergente,"E se tudo em que você acreditasse fosse uma mentira? Em <em>Convergente</em>, o aguardado volume final da trilogia <em>Divergente</em>, de Veronica Roth, uma revelação que deveria ter permanecido em segredo põe em questão a existência da sociedade baseada em facções na qual a protagonista Tris Prior acreditara um dia. Um novo mundo é revelado além dos muros da Chicago distópica em que Tris nasceu e cresceu, e ela é mais uma vez obrigada a fazer escolhas que exigem coragem, fidelidade, sacrifício e amor. O livro, que chegou ao Brasil um mês antes da estreia de<em>Divergente</em> nos cinemas, alcançou o primeiro lugar na lista de bestsellers do <em>The New York Times</em> e foi o título mais vendido pela gigante Amazon no segmento infantojuvenil em 2013.",28,0,"Veronica Roth",1,1,0,5022,4
9788579801860,Convergente,"E se tudo em que você acreditasse fosse uma mentira? Em <em>Convergente</em>, o aguardado volume final da trilogia <em>Divergente</em>, de Veronica Roth, uma revelação que deveria ter permanecido em segredo põe em questão a existência da sociedade baseada em facções na qual a protagonista Tris Prior acreditara um dia. Um novo mundo é revelado além dos muros da Chicago distópica em que Tris nasceu e cresceu, e ela é mais uma vez obrigada a fazer escolhas que exigem coragem, fidelidade, sacrifício e amor. O livro, que chegou ao Brasil um mês antes da estreia de<em>Divergente</em> nos cinemas, alcançou o primeiro lugar na lista de bestsellers do <em>The New York Times</em> e foi o título mais vendido pela gigante Amazon no segmento infantojuvenil em 2013.",28,0,"Veronica Roth",1,1,0,5023,4
9788579801242,Herança,NULL,82,0,"Christopher Paolini",1,1,0,5024,4
9788579801242,Herança,NULL,82,0,"Christopher Paolini",1,1,0,5025,4
9788579800719,"Era uma vez minha primeira vez",NULL,68,0,"Thalita Rebouças",1,1,0,5026,4
9788579800511,"Ela disse, ele disse",NULL,92,0,"Thalita Rebouças",1,1,0,5027,4
9788579620676,"O sonho do Celta",NULL,92,0,"Mario Vargas Llosa",1,1,0,5028,4
9788579309915,"Cúmplices de um resgate","Este é um livro especial para fãs. Com fotos exclusivas e muitas curiosidades, fique por dentro de tudo o que acontece nos bastidores de sua novela preferida. Descubra fatos inusitados que ocorrem nas gravações, diversos segredinhos que serão revelados ao longo dos capítulos, ficha dos clipes mais especiais da novela, conheça o perfil profissional e a vida pessoal dos atores que você mais ama, além de curiosidades, fotos incríveis e um superquiz para você testar o seu conhecimento. Além disso, você irá conhecer o dossiê completo de Larissa Manoela, a atriz que interpreta nossas gêmeas prediletas na telinha.",45,0,"Universo dos Livros",1,1,0,5029,4
9788579309915,"Cúmplices de um resgate","Este é um livro especial para fãs. Com fotos exclusivas e muitas curiosidades, fique por dentro de tudo o que acontece nos bastidores de sua novela preferida. Descubra fatos inusitados que ocorrem nas gravações, diversos segredinhos que serão revelados ao longo dos capítulos, ficha dos clipes mais especiais da novela, conheça o perfil profissional e a vida pessoal dos atores que você mais ama, além de curiosidades, fotos incríveis e um superquiz para você testar o seu conhecimento. Além disso, você irá conhecer o dossiê completo de Larissa Manoela, a atriz que interpreta nossas gêmeas prediletas na telinha.",45,1,"Universo dos Livros",1,1,1,5030,4
9788579309519,"Mentes fantásticas","No novo livro de Alberto Dell'Isola você vai descobrir que é possível utilizar induções simples e inovadoras para alcançar os objetivos que tanto almeja,sejam eles aumentar a capacidade do seu cérebro, superar as adversidades, ler mentes, detectar mentiras ou ainda no tratamento contra a insônia ou o vício em cigarro. Com uma linguagem simples e trazendo rotinas e diretrizes para quem deseja praticar a hipnose, a auto-hipnose e o mentalismo, você descobrirá seus usos no dia a dia e porque sua mente é sua melhor aliada rumo ao sucesso.",88,0,"Alberto Dell&#039;Isolla",1,1,0,5031,4
9788579308970,"Viagem Pelo Mundo Para Colorir","Indicado para adultos e crianças, Viagem pelo mundo para colorir apresenta incríveis localidades turísticas e seus patrimônios históricos. Cada página contém informações sobre o país, a cultura e ícones importantes da região.<br>",0,0,"Universo dos Livros",1,1,0,5032,4
9788579308635,"Floresta dos sonhos","Percorra a <em>Floresta dos Sonhos</em> e descubra os mistérios desta fascinante jornada! Aventure-se e desbrave as ilustrações desta mágica floresta ao escolher os melhores conjuntos de cores para pintar os diversos animais, flores, paisagens e outros elementos da natureza contidos neste livro. Ah, e não se esqueça de procurar pelos elementos escondidos entre as figuras! Ao colorir, é possível afastar a mente dos problemas cotidianos e aliviar o estresse acumulado no dia a dia, além de proporcionar sensação de prazer por trazer ainda mais vivacidade aos desenhos apresentados. Exercite a criatividade e o entusiasmo a partir da arteterapia, adicionando mais momentos de tranquilidade à sua vida.",4,0,"Rita Perez",1,1,0,5033,4
9788579308512,"Manual de persuasão do FBI","Ex-agente do FBI ensina como influenciar, atrair e conquistar pessoas! Como um agente especial para o Programa de Análise Comportamental da Divisão de Segurança Nacional do FBI, Dr. Jack Schafer desenvolveu estratégias dinâmicas e inovadoras para entrevistar terroristas e detectar mentiras. Agora, Dr. Schafer evoluiu suas táticas e nos ensina como aplicá-las no cotidiano para obter sucesso nas relações interpessoais.",56,0,"Marvin Karlins / Jack Shafer",1,1,0,5034,4
9788579308406,"Dulce Amargo",NULL,60,0,"Dulce Maria",1,1,0,5035,4
9788579308253,"Demi Lovato - edição especial para fãs",NULL,72,0,Vários,1,1,0,5036,4
9788579306747,"Playboy irresistível",NULL,0,0,"Christina Lauren",1,1,0,5037,4
9788579305368,"Os cães nunca deixam de amar",NULL,12,0,"Teresa J. Rhyne",1,1,0,5038,4
9788579305351,"Essa ideia é tão boa que parece que foi sua","Fundamentado numa pesquisa feita com mais de 12 mil empresários ao longo de quatro anos, este livro é o guia indispensável sobre o networking moderno. Perspicaz e irreverente, com esse livro você nunca mais terá que adivinhar o que o outro está pensando. Se você precisa se conectar com outras pessoas - seja você homem, mulher, empresário experiente ou novato -, as chaves para uma comunicação eficaz estão aqui. Networking refere-se a relacionamentos, pura e simplesmente. Compreender o sexo oposto sob uma ótica nova e positiva é a chave para desenvolver relações de negócios duradouras e aumentar o sucesso.",56,0,"Ivan Misner",1,1,0,5039,4
9788579304002,"Mentes milionárias",NULL,72,0,"Susan Reynolds",1,1,0,5040,4
9788579303272,"O homem que não queria ser Papa",NULL,76,0,"Andreas Englisch",1,1,0,5041,4
9788579303197,"Como convencer alguém em 90 segundos",NULL,0,0,"Nicholas Boothman",1,1,0,5042,4
9788579302893,"Nunca fui santo",NULL,68,1,"Marcos Reis e Mauro Beting",1,1,1,5043,3
9788579302893,"Nunca fui santo",NULL,68,1,"Marcos Reis e Mauro Beting",1,1,1,5044,3
9788579302763,"Mentes geniais",NULL,20,0,"Alberto Dell&#039;Isolla",1,1,0,5045,3
9788579301261,"Desvendando o nosso lar",NULL,58,0,"Luis Eduardo de Sousa",1,1,0,5046,3
9788579300707,"Deixe os homens aos seus pés",NULL,92,0,"Marie Forleo",1,1,0,5047,2
9788579300707,"Deixe os homens aos seus pés",NULL,92,0,"Marie Forleo",1,1,0,5048,2
9788579271076,"Justin Bieber - Uma Biografia Não Autorizada","A biografia narra a vida pessoal e a trajetória profissional de Justin Bieber, desde os tempos como garoto comum da pacata cidade canadense de Stratford até despontar como um dos maiores fenômenos pop da atualidade. O livro aborda assuntos como a vida difícil que Bieber levava ao lado da mãe, logo após a separação dos pais, revela os bastidores da disputa entre Usher e Justin Timberlake pelo lançamento do primeiro álbum do garoto e relata algumas situações vividas por ele em sua vida particular e amorosa.",16,0,"Chas Newkey- Urden",1,1,0,5049,2
9788578885953,Tite,"A jornalista Camila Mattoso conta a trajetória do técnico e revela detalhes da vida pessoal do homem por trás do ídolo. A obra é resultado dos 84 depoimentos ouvidos pela autora, entre familiares, amigos, jogadores e dirigentes. O livro, lançado pela Panda Books, traça um perfil de Adenor Leonardo Bachi, que vai desde seu nascimento, em uma colônia no Rio Grande do Sul, até a conquista do hexacampeonato.",40,0,"Camila Mattoso",1,1,0,5050,2
9788578607654,"Namoro blindado","Qualquer que seja a sua fase de solteiro – se está só, esperando, paquerando, ficando, namorando, catando os pedaços do seu coração, divorciado, viúvo ou enrolado – este livro ajudará a se situar para não se perder no mundo cada vez mais complicado dos relacionamentos modernos. Anos de experiência garantiram a Renato e a Cristiane Cardoso autoridade para afirmar que a maioria dos divórcios começa... no namoro! <em>Namoro Blindado</em> abre os olhos e mostra, na prática, como agir. É o manual para qualquer idade, da adolescência aos solteiros mais maduros. Afinal, nunca é cedo (nem tarde) demais para aprender o amor inteligente.",20,0,"Renato e Cristiane Cardoso",1,1,0,5051,2
9788578607654,"Namoro blindado","Qualquer que seja a sua fase de solteiro – se está só, esperando, paquerando, ficando, namorando, catando os pedaços do seu coração, divorciado, viúvo ou enrolado – este livro ajudará a se situar para não se perder no mundo cada vez mais complicado dos relacionamentos modernos. Anos de experiência garantiram a Renato e a Cristiane Cardoso autoridade para afirmar que a maioria dos divórcios começa... no namoro! <em>Namoro Blindado</em> abre os olhos e mostra, na prática, como agir. É o manual para qualquer idade, da adolescência aos solteiros mais maduros. Afinal, nunca é cedo (nem tarde) demais para aprender o amor inteligente.",20,0,"Renato e Cristiane Cardoso",1,1,0,5052,2
9788578605025,"120 minutos para blindar seu casamento",NULL,56,0,"Renato e Cristiane Cardoso",1,1,0,5053,2
9788578603144,"Vitor Belford",NULL,40,0,"Vitor Belford",1,1,0,5054,2
9788578602826,"Diário do amor inteligente","&nbsp;Com as dicas práticas, retiradas do best-seller Namoro blindado, o leitor aprenderá como tomar decisões inteligentes no amor e revolucionar sua vida de solteiro, independente de qual fase do namoro esteja &nbsp; esperando, conhecendo ou noivando. Afinal de contas, nunca é tarde (ou cedo) demais para descobrir como viver à prova de coração partido.",24,0,"Renato e Cristiane Cardoso",1,1,0,5055,2
9788578600501,"Mais tempo mais dinheiro",NULL,64,0,"Gustavo Cerbasi / Christian Barbosa",1,1,0,5056,2
9788578311186,"Alternativas que funcionam","Seu ambiente de trabalho está repleto de bloqueios frustrantes ? Você precisa dar andamento a um projeto, mas as regras da companhia provocam atrasos ? Processos desnecessários e resistências internas sempre estão no seu caminho ? Você realmente precisa de alternativas! Alternativas que funcionam ensina a arte da alternativa: um método para cumprir uma tarefa ou uma meta.",72,0,"Russell BIshop",1,1,1,5057,2
9788578311179,"Metas que desafiam",NULL,60,0,"Mark Murphy",1,1,1,5058,2
9788578311179,"Metas que desafiam",NULL,60,0,"Mark Murphy",1,1,1,5059,2
9788578311155,"Coaching para aprimorar o desempenho","O coaching é um conhecimento técnico que requer profundidade, compreensão e uma prática considerável para que se realize em todo seu assombroso potencial. Esta nova edição de coaching para aprimorar o desempenho, ampliada e revisada, explica claramente os princípios do treinamento, ilustrando-os com exemplos de alto desempenho nos meios empresarial e desportivo.",80,0,"John Whitmore",1,1,1,5060,2
9788578311148,"Os 3 compromissos da liderança",NULL,48,0,"Tom Endersbe",1,1,1,5061,2
9788578311148,"Os 3 compromissos da liderança",NULL,48,1,"Tom Endersbe",1,1,1,5062,2
9788578311094,"Inteligência emocional na gestão de resultados","Na última década, a inteligência emociona tem sido vista como um pilar crítico de sucesso dentro e fora do trabalho. Ela tem se tornado cada vez mais importante, já que a diversificação do ambiente profissional tem se tornado progressivamente diverso e tem trazido juntamente diferenças que são desafiadoras. Contudo, apesar de sua importância, a maioria das pessoas não tem sido ensinada a como desenvolver este aspecto nelas mesmo, não conhecem os métodos e nem as ferramentas necessárias para lidar com os sentimentos que são cruciais para a eficácia no trabalho, nos relacionamentos e na vida. <em>Inteligência emocional na gestão de resultados</em> oferece o conhecimento necessário sobre como gerir efetivamente o ambiente de trabalho, usando os princípios dinâmicos da ""inteligência emocional"" para aumentar a sua competência em lidar com as emoções e melhorar sua eficácia profissional e pessoal.<br>",32,0,"Lee Gardenswartz / Anita Rowe / Jorge Cherbosque",1,1,1,5063,2
9788578310912,"Os oito pilares da prosperidade",NULL,42,0,"James Allen",1,1,1,5064,2
9788578310899,"A ciência de ficar rico","Este livro baseia-se no que Wallace Wattles chamou de ""a maneira certa de pensar"". Ele explica como superar todo o tipo de condicionamento (mental, social, de saúde, etc) para, por meio da criação e da não competição, atrair e conquistar riquezas. Um dos principais pilares desta obra é a afirmação de que podemos conseguir o que quisermos meramente pela força do pensamento direcionado e determinado. Descartando a postura competitiva do capitalismo, este livro defenda uma atitude criativa, em alinhamento com as leis universais, segundo as quais o universo consciente a todos provê sem distinção e sem limites. Esse é o centro de sua ""ciência"" da criação da riqueza. Unindo metafísica e ciência, Wattles afirma que ficar rico é algo infalível. Conforme o autor, seguindo ""com fé e propósito"" os ensinamentos contidos em seu livro e agindo de acordo com eles, sem temor e hesitação, todo homem e toda mulher certamente ficarão ricos, pois a ciência aplicada desse modo é uma ciência exata, e o fracasso impossível.",42,0,"Wallace D. Wattles",1,1,1,5065,2
9788578310882,"O poder oculto",NULL,52,0,"Thomas Troward",1,1,1,5066,2
9788578310738,"Gerente eficaz",NULL,84,0,"Michael Armstrong",1,1,1,5067,2
9788578310691,"Aperfeiçoe suas técnicas de liderança",NULL,0,0,"John Adair",1,1,1,5068,2
9788578310431,"51 atitudes para vencer na vida e na carreira",NULL,10,0,"Carlos Hilsdorf",1,1,1,5069,2
9788578310394,"Liderança e motivação","Neste livro, John Adair estuda a natureza da motivação, as necessidades individuais e como aplicar tudo isso aos desafios diários com que se deparam líderes e gerentes. Para tanto, apresenta sua teoria da motivação e identifica os oitos princípios básicos para motivar as pessoas. <em>Liderança e Motivação</em> estimula os pensamentos e as ideias sobre como inspirar os outros e a si mesmo para o sucesso.",28,0,"John Adair",1,1,1,5070,2
9788578277109,"O hobbit","Bilbo Bolseiro é um hobbit que leva uma vida confortável e sem ambições. Mas seu contentamento é perturbado quando Gandalf, o mago, e uma companhia de anões batem à sua porta e levam-no para uma expedição. Eles têm um plano para roubar o tesouro guardado por Smaug, o Magnífico, um grande e perigoso dragão. Bilbo reluta muito em participar da aventura, mas acaba surpreendendo até a si mesmo com sua esperteza e sua habilidade como ladrão!",28,0,"J. R. R. Tolkien",1,1,0,5071,2
9788578276874,"Barriga de trigo",NULL,52,0,"William Davis",1,1,0,5072,2
9788578276225,"O Hobbit",NULL,20,0,"J. R. R. Tolkien",1,1,0,5073,2
9788578273422,"Quem é você, Alasca?","Miles Halter é um adolescente fissurado por célebres últimas palavras que, cansado de sua vidinha pacata e sem graça em casa, vai estudar num colégio interno à procura daquilo que o poeta François Rabelais, quando estava à beira da morte, chamou de o ""Grande Talvez"". Muita coisa o aguarda em Culver Creek, inclusive Alasca Young, uma garota inteligente, espirituosa, problemática e extremamente sensual, que o levará para o seu labirinto e o catapultará em direção ao Grande Talvez.",40,0,"John Green",1,1,0,5074,2
9788578273422,"Quem é você, Alasca?","Miles Halter é um adolescente fissurado por célebres últimas palavras que, cansado de sua vidinha pacata e sem graça em casa, vai estudar num colégio interno à procura daquilo que o poeta François Rabelais, quando estava à beira da morte, chamou de o ""Grande Talvez"". Muita coisa o aguarda em Culver Creek, inclusive Alasca Young, uma garota inteligente, espirituosa, problemática e extremamente sensual, que o levará para o seu labirinto e o catapultará em direção ao Grande Talvez.",40,0,"John Green",1,1,0,5075,4
