BookCode,BookTitle,BookDescription,CountPage,PrintType,Authors,SalesAvailable,PublicDomain,PreviewAvaliable,idBookDimension,BookCategory
9788567028835,"Segredos da Bel para meninas","Criadoras do canal Bel para Meninas e do Penteados para Meninas, encantaram o Brasil com uma forma de ver a vida de um jeito mais divertido, espalhando a felicidade e a simplicidade. No mundo da Bel, é possível falar de brincadeiras, comidas e acontecimentos da vida cotidiana com a leveza dos olhos de uma criança. Neste livro totalmente colorido, Bel e sua mãe vão contar suas melhores ideias para estimularem pessoas de todas as idades a se divertirem juntas.",28,0,"Bel / Fran",1,1,0,5306,4
9788567028514,"A teoria de tudo","O livro que inspirou o emocionante filme <em>A Teoria de Tudo</em>. Quando Jane conhece Stephen, percebe que está entrando para uma família que é pelo menos diferente. Com grande sede de conhecimento, os Hawking possuíam o hábito de levar material de leitura para o jantar, ir a óperas e concertos e estimular o brilhantismo em seus filhos – entre eles aquele que seria conhecido como um dos maiores gênios da humanidade, Stephen.Descubra a história por trás de Stephen Hawking, cientista e autor de sucessos como Uma breve história do tempo, que já vendeu mais de 25 milhões de exemplares. Diagnosticado com esclerose lateral amiotrófica aos 21 anos, enquanto conhecia a jovem tímida Jane, Hawking superou todas as expectativas dos médicos sobre suas chances de sobrevivência a partir da perseverança de sua mulher. Mesmo ao descobrir que a condição de Stephen apenas pioraria, Jane seguiu firme na decisão de compartilhar a vida com aquele que havia lhe encantado. Ao contar uma trajetória de 25 anos de casamento e três filhos, ela mostra uma história universal e tocante, narrada sob um ponto de vista único.Stephen Hawking chega o mais próximo que alguém já conseguiu de explicar o sentido da vida, enquanto Jane nos mostra que já o conhecia desde sempre: ele está na nossa capacidade de amar e de superar limites em nome daqueles que escolhemos para compartilhar a vida.",48,0,"Jane Hawking",1,1,0,5307,4
9788566636260,"Star Wars - a trilogia","Star Wars, A Trilogia reúne os romances inspirados nos três primeiros filmes do universo fantástico criado por George Lucas: Uma Nova Esperança, O Império Contra-Ataca e O Retorno de Jedi. Os três títulos chegaram a ser lançados no Brasil, sendo o último deles em 1983. Mas esta será a primeira vez que a trilogia completa é editada em nosso país num único volume, ilustrado e em capa dura.",28,0,"George Lucas / Donald F. Glut / James Kahn",1,1,0,5308,4
9788566031454,"Como saí do buraco","No livro 'Como Saí do Buraco', Fly narra sua trajetória e mostra como ganhou muito dinheiro, perdeu tudo e conseguiu retomar as rédeas de suas finanças. A obra narra a sua infância pobre e a criatividade para inventar trabalho e ganhar dinheiro. De vendedor de ferro-velho a diretor de TV, Fly revela, através de histórias, seu espírito empreendedor em busca do sucesso. Como educador financeiro, Fly dá palestras em todo Brasil. ",16,0,"Fly (Vagner Menezes)",1,1,0,5309,4
9788566023084,"Casa das estrelas","Durante mais de dez anos o professor Javier Naranjo guardou as definições que seus alunos do curso primário (entre 3 e 10 anos) davam para palavras, objetos, pessoas e, principalmente sentimentos, em suas aulas de espanhol. Algumas centenas destas definições estão reunidas em <em>Casa das Estrelas</em>. São poéticas, engraçadas, muitas vezes melancólicas. São universais.</p><section></sect",28,0,"Javier Naranjo",1,1,0,5310,4
9788565859868,"A história da mitologia para quem tem pressa","Nesta introdução à mitologia, Mark Daniels explora as antigas histórias dos aborígenes australianos, sumérios, egípcios, chineses, índios norte-americanos, maias, incas, astecas, gregos, romanos e nórdicos, entre outros. Desemaranhando a complexa teia de deuses e deusas, divindades menores e monstros, Daniels revela as criaturas e as narrativas do passado que tanta influência exerceram sobre as culturas do presente. Descubra por que Odin, o Pai dos Deuses na mitologia nórdica, estava tão interessado em perder o olho, a importância do mito de Osíris no Antigo Egito, mitos gregos, astecas, chineses, nórdicos, egípcios, romanos, e muito mais.",0,0,"Mark Daniels",1,1,0,5311,4
9788565859516,"A história do mundo para quem tem pressa","O livro é na verdade um guia sintético, mas abrangente, para tudo o que precisamos saber sobre os acontecimentos mais importantes da história, desde as antigas civilizações até o final da Segunda Guerra Mundial e a criação da ONU.",0,0,"Emma Marriott",1,1,0,5312,4
9788565765947,"Espada de vidro","O sangue de Mare Barrow é vermelho, da mesma cor da população comum, mas sua habilidade de controlar a eletricidade a torna tão poderosa quanto os membros da elite de sangue prateado. Depois que essa revelação foi feita em rede nacional, Mare se transformou numa arma perigosa que a corte real quer esconder e controlar. Quando finalmente consegue escapar do palácio e do príncipe Maven, Mare descobre algo surpreendente: ela não era a única vermelha com poderes. ",96,0,"Victoria Aveyard",1,1,0,5313,4
9788565765947,"Espada de vidro","O sangue de Mare Barrow é vermelho, da mesma cor da população comum, mas sua habilidade de controlar a eletricidade a torna tão poderosa quanto os membros da elite de sangue prateado. Depois que essa revelação foi feita em rede nacional, Mare se transformou numa arma perigosa que a corte real quer esconder e controlar. Quando finalmente consegue escapar do palácio e do príncipe Maven, Mare descobre algo surpreendente: ela não era a única vermelha com poderes. ",96,0,"Victoria Aveyard",1,1,0,5314,4
9788565765930,"A sereia","Anos atrás, Kahlen foi salva de um naufrágio pela própria Água. Para pagar sua dívida, a garota se tornou uma sereia e, durante cem anos, precisa usar sua voz para atrair as pessoas para se afogarem no mar. Kahlen está decidida a cumprir sua sentença à risca, até que ela conhece Akinli. Lindo, carinhoso e gentil, o garoto é tudo o que Kahlen sempre sonhou. Apesar de não poderem conversar - pois a voz da sereia é fatal -, logo surge uma conexão intensa entre os dois. É contra as regras se apaixonar por um humano, e se a Água descobrir, Kahlen será obrigada a abandonar Akinli para sempre. Mas pela primeira vez em muitos anos de obediência, ela está determinada a seguir seu coração.",68,0,"Kiera Cass",1,1,0,5315,4
9788565765930,"A sereia","Anos atrás, Kahlen foi salva de um naufrágio pela própria Água. Para pagar sua dívida, a garota se tornou uma sereia e, durante cem anos, precisa usar sua voz para atrair as pessoas para se afogarem no mar. Kahlen está decidida a cumprir sua sentença à risca, até que ela conhece Akinli. Lindo, carinhoso e gentil, o garoto é tudo o que Kahlen sempre sonhou. Apesar de não poderem conversar - pois a voz da sereia é fatal -, logo surge uma conexão intensa entre os dois. É contra as regras se apaixonar por um humano, e se a Água descobrir, Kahlen será obrigada a abandonar Akinli para sempre. Mas pela primeira vez em muitos anos de obediência, ela está determinada a seguir seu coração.",68,0,"Kiera Cass",1,1,0,5316,4
9788565765657,"A herdeira","Vinte anos atrás, America Singer participou da Seleção e conquistou o coração do príncipe Maxon. Agora chegou a vez da princesa Eadlyn, filha do casal. Prestes a conhecer os trinta e cinco pretendentes que irão disputar sua mão numa nova Seleção, ela não tem esperanças de viver um conto de fadas como o de seus pais… Mas assim que a competição começa, ela percebe que encontrar seu príncipe encantado talvez não seja tão impossível quant",60,0,"Kiera Cass",1,1,0,5317,4
9788565765657,"A herdeira","Vinte anos atrás, America Singer participou da Seleção e conquistou o coração do príncipe Maxon. Agora chegou a vez da princesa Eadlyn, filha do casal. Prestes a conhecer os trinta e cinco pretendentes que irão disputar sua mão numa nova Seleção, ela não tem esperanças de viver um conto de fadas como o de seus pais… Mas assim que a competição começa, ela percebe que encontrar seu príncipe encantado talvez não seja tão impossível quant",60,0,"Kiera Cass",1,1,0,5318,4
9788565765619,"Felizes para sempre","Esta coletânea traz os contos ""A rainha"", ""O príncipe"", ""O guarda"" e ""A favorita"" ilustrados e com introduções inéditas de Kiera Cass. Você encontrará, ainda, cenas inéditas da série narradas pelos pontos de vista de Celeste e Lucy, um texto contando o que aconteceu com as outras Selecionadas depois do fim da competição e um trecho exclusivo de ""A sereia"", o novo romance de Kiera Cass.",48,0,"Kiera Cass",1,1,0,5319,4
9788565765619,"Felizes para sempre","Esta coletânea traz os contos ""A rainha"", ""O príncipe"", ""O guarda"" e ""A favorita"" ilustrados e com introduções inéditas de Kiera Cass. Você encontrará, ainda, cenas inéditas da série narradas pelos pontos de vista de Celeste e Lucy, um texto contando o que aconteceu com as outras Selecionadas depois do fim da competição e um trecho exclusivo de ""A sereia"", o novo romance de Kiera Cass.",48,0,"Kiera Cass",1,1,0,5320,4
9788565765329,"Contos da seleção - O príncipe e o guarda",NULL,64,0,"Kiera Cass",1,1,0,5321,4
9788565530903,Ardente,NULL,16,0,"Sylvia Day",1,1,0,5322,4
9788565530835,"Somente sua","Gideon me chama de anjo, mas é ele o milagre na minha vida. Meu deslumbrante guerreiro ferido, determinado a destruir meus demônios, ao mesmo tempo em que se recusa a encarar os seus. Os votos que trocamos deveriam ter nos deixado mais próximos do que nunca. Em vez disso, abriram feridas antigas, expuseram dor e insegurança, e atraíram os meus inimigos a sair das sombras. Senti que ele se distanciava. Meus maiores medos pareciam virar realidade; meu amor estava sendo testado, me deixando em dúvida se seria forte o suficiente para aguentar. No momento mais alegre de nossas vidas, a escuridão do passado dele ressurge e ameaça tudo pelo que trabalhamos até agora. Teremos que encarar uma escolha terrível: a segurança da vida que tínhamos antes de nos conhecermos ou um futuro que de repente parece um sonho impossível e sem esperança… ",12,0,"Sylvia Day",1,1,0,5323,1
9788565530835,"Somente sua","Gideon me chama de anjo, mas é ele o milagre na minha vida. Meu deslumbrante guerreiro ferido, determinado a destruir meus demônios, ao mesmo tempo em que se recusa a encarar os seus. Os votos que trocamos deveriam ter nos deixado mais próximos do que nunca. Em vez disso, abriram feridas antigas, expuseram dor e insegurança, e atraíram os meus inimigos a sair das sombras. Senti que ele se distanciava. Meus maiores medos pareciam virar realidade; meu amor estava sendo testado, me deixando em dúvida se seria forte o suficiente para aguentar. No momento mais alegre de nossas vidas, a escuridão do passado dele ressurge e ameaça tudo pelo que trabalhamos até agora. Teremos que encarar uma escolha terrível: a segurança da vida que tínhamos antes de nos conhecermos ou um futuro que de repente parece um sonho impossível e sem esperança… ",12,0,"Sylvia Day",1,1,0,5324,1
9788565530699,"Uma página de cada vez",NULL,68,0,"Adam J Kurtz",1,1,0,5325,1
9788565530606,"A dieta da mente","Em 'A dieta da mente', David Perlmutter apresenta uma descoberta que há muito tempo tem sido escondida pela literatura médica - os carboidratos podem destruir seu cérebro. Até mesmo aqueles considerados 'saudáveis', como os grãos integrais, podem causar demência, déficit de atenção, epilepsia, ansiedade, enxaquecas, depressão, redução da libido e muito mais. 'A dieta da mente' mostra que o destino do seu cérebro não está na sua genética. Está naquilo que você come. Misturando pesquisas de ponta e histórias reais de transformação, David Perlmutter explica por que uma dieta rica em 'gorduras boas' é ideal para o corpo e poderá fazê-lo emagrecer sem voltar a engordar. ",44,0,"David Perlmutter",1,1,0,5326,1
9788565530569,"Da minha terra à Terra",NULL,76,0,"Sebastião Salgado",1,1,0,5327,1
9788565530194,"Profundamente sua",NULL,56,0,"Sylvia Day",1,1,0,5328,1
9788565530194,"Profundamente sua",NULL,56,0,"Sylvia Day",1,1,0,5329,1
9788565530101,"Sua vida em movimento",NULL,20,0,"Márcio Atalla",1,1,0,5330,1
9788565482202,"O executivo e o martelo",NULL,72,0,"Clovis de Barros Filho",1,1,0,5331,1
9788564684591,"Deuses de dois mundos - o livro da morte",NULL,44,0,"PJ Pereira",1,1,0,5332,1
9788564431010,"Pulmão de aço",NULL,40,1,"Eliana Zagui",1,1,1,5333,1
9788564065567,"As melhores frases em Veja",NULL,56,0,"Julio Cesar de Barros",1,1,0,5334,1
9788564065178,"A dieta Gracie",NULL,76,0,"Rorion Gracie",1,1,0,5335,1
9788563808264,"Sempre melhor",NULL,24,0,"José Carlos De Lucca",1,1,0,5336,1
9788563795106,"Mandalas fantásticas",NULL,4,0,"Jenean Morrison",1,1,0,5337,1
9788563795090,"Flores encantadas",NULL,4,0,"Jenean Morrison",1,1,0,5338,1
9788563680280,"Terapia Financeira - Realize Seus Sonhos Com Educação Financeira","Em Terapia financeira, Reinaldo Domingos apresenta a metodologia que desenvolveu, a partir de sua experiência pessoal, para ajudar as pessoas a lidar de maneira saudável com suas finanças, a fim de conquistar o equilíbrio e a independência financeira e viabilizar seus sonhos. <br>Partindo da constatação de que as gerações passadas não aprenderam a lidar com o dinheiro de forma estruturada, Reinaldo decidiu sintetizar num livro o resultado de anos de reflexão e observação do comportamento humano, associado às práticas cotidianas e aos conceitos que desenvolveu ao longo do tempo, o que constitui a filosofia de vida que o levou a conquistar sua independência financeira antes dos 40 anos de idade.<br>",28,0,"Reinaldo Domingos",1,1,0,5339,1
9788563420046,"O piloto de Hitler",NULL,40,0,"C. G. Sweeting",1,1,1,5340,1
9788563420046,"O piloto de Hitler",NULL,40,0,"C. G. Sweeting",1,1,0,5341,1
9788563219947,"Presentes da vida","=""pn-ranking-livro-resumo"">Novo romance de Emily Giffin &eacute; lan&ccedil;ado no Brasil. <em>Presentes da vida</em>&nbsp;narra a reviravolta ocorrida na vida de uma mulher. Darcy Rhone tinha tudo em suas m&atilde;os: beleza, poder de sedu&ccedil;&atilde;o, um emprego incr&iacute;vel e um noivo a seus p&eacute;s. Por&eacute;m, depois de trair seu noivo com um amigo, ela desiste do casamento e perde sua melhor amiga, Rachel. Para fugir dos problemas, Darcy se muda para Londres. Come&ccedil;a ent&atilde;o a transforma&ccedil;&atilde;o em sua vida, a partir da descoberta da import&acirc;ncia do altru&iacute;smo e da amizade. Emily Giffin &eacute; autora de <em>Ame o que &eacute; seu</em>, <em>Quest&otilde;es do cora&ccedil;&atilde;o</em> e <em>Baby proof</em>, que j&aacute; venderam mais de 5 milh&otilde;es de exemplares&nbsp;no mundo. No Brasil, os dois primeiros t&iacute;tulos venderam mais de 100 mil c&oacute;pias, segundo a edit",83,0,"Emily Giffin",1,1,0,5342,1
9788563219947,"Presentes da vida","=""pn-ranking-livro-resumo"">Novo romance de Emily Giffin &eacute; lan&ccedil;ado no Brasil. <em>Presentes da vida</em>&nbsp;narra a reviravolta ocorrida na vida de uma mulher. Darcy Rhone tinha tudo em suas m&atilde;os: beleza, poder de sedu&ccedil;&atilde;o, um emprego incr&iacute;vel e um noivo a seus p&eacute;s. Por&eacute;m, depois de trair seu noivo com um amigo, ela desiste do casamento e perde sua melhor amiga, Rachel. Para fugir dos problemas, Darcy se muda para Londres. Come&ccedil;a ent&atilde;o a transforma&ccedil;&atilde;o em sua vida, a partir da descoberta da import&acirc;ncia do altru&iacute;smo e da amizade. Emily Giffin &eacute; autora de <em>Ame o que &eacute; seu</em>, <em>Quest&otilde;es do cora&ccedil;&atilde;o</em> e <em>Baby proof</em>, que j&aacute; venderam mais de 5 milh&otilde;es de exemplares&nbsp;no mundo. No Brasil, os dois primeiros t&iacute;tulos venderam mais de 100 mil c&oacute;pias, segundo a edit",83,0,"Emily Giffin",1,1,0,5343,1
9788563219473,"Laços inseparáveis",NULL,84,0,"Emily Giffin",1,1,0,5344,1
9788563219428,"Uma vida sem limites",NULL,64,0,"Nick Vujicic",1,1,0,5345,1
9788563219206,"Diário de uma paixão",NULL,56,0,"Nicholas Sparks",1,1,0,5346,1
9788563219206,"Diário de uma paixão",NULL,56,0,"Nicholas Sparks",1,1,0,5347,1
9788563219183,"Morte e vida de Charlie St. Cloud",NULL,4,0,"Ben Sherwood",1,1,0,5348,1
9788563219183,"Morte e vida de Charlie St. Cloud",NULL,4,0,"Ben Sherwood",1,1,0,5349,1
9788563219145,"Beijada por um anjo",NULL,64,0,"Elizabeth Chandler",1,1,0,5350,1
9788563219138,"Um homem de sorte","=""pn-ranking-livro-resumo"">Ao encontrar a foto de Elisabeth nas areias do Iraque, o soldado Logan Thibault não imaginava que um dia deveria a vida àquela jovem. Após atravessar os Estados Unidos a pé para encontrá-la, já podia prever que o seu destino começava com a letra dela: E. A foto de Elisabeth tece a trama do novo livro de Nicholas Sparks, ""Um homem de sorte"". Ao longo da história, o relacionamento dos jovens, que parecia perfeito, começa a enfrentar obstáculos. A opressão do ex-marido de Elisabeth, Clayton, um homem poderoso na cidade, fica insuportável. Seus ciúmes e egoísmo afetam até mesmo Ben, seu filho e último laço com ela. Logan recebe ameaças enquanto descobre o que está por trás do comportamento misterioso de Clay",49,0,"Nicholas Sparks",1,1,0,5351,1
9788563219138,"Um homem de sorte","=""pn-ranking-livro-resumo"">Ao encontrar a foto de Elisabeth nas areias do Iraque, o soldado Logan Thibault não imaginava que um dia deveria a vida àquela jovem. Após atravessar os Estados Unidos a pé para encontrá-la, já podia prever que o seu destino começava com a letra dela: E. A foto de Elisabeth tece a trama do novo livro de Nicholas Sparks, ""Um homem de sorte"". Ao longo da história, o relacionamento dos jovens, que parecia perfeito, começa a enfrentar obstáculos. A opressão do ex-marido de Elisabeth, Clayton, um homem poderoso na cidade, fica insuportável. Seus ciúmes e egoísmo afetam até mesmo Ben, seu filho e último laço com ela. Logan recebe ameaças enquanto descobre o que está por trás do comportamento misterioso de Clay",49,0,"Nicholas Sparks",1,1,0,5352,1
9788563219077,"A última música","=""pn-ranking-livro-resumo""><font face=""Verdana"">No romance &ldquo;A &uacute;ltima m&uacute;sica&rdquo;, Nicholas Sparks apresenta uma hist&oacute;ria sobre fam&iacute;lia, amizade, amor, amadurecimento e especialmente sobre como perdoar e recome&ccedil;ar. Aos dezessete anos, Ver&ocirc;nica Miller, ou simplesmente Ronnie, v&ecirc; sua vida virar de cabe&ccedil;a para baixo quando seus pais se divorciam e seu pai decide ir para a praia de Wrightsville, na Carolina do Norte. Tr&ecirc;s anos depois, ela continua magoada e distante dos pais, mas sua m&atilde;e decide que seria melhor os filhos passarem as f&eacute;rias de ver&atilde;o com o pai na Carolina do Norte. Ronnie rejeita qualquer tentativa de aproxima&ccedil;&atilde;o e amea&ccedil;a voltar para Nova York antes do ver&atilde;o acabar. &Eacute; quando ela conhece Will, o garoto mais popular da cidade. A paix&atilde;o pelo garoto abre uma nova experi&ecirc;ncia para a jovem, que vai experimentar uma felicidade nunca antes sentida.</f",0,0,"Nicholas Sparks",1,1,0,5353,1
9788563219077,"A última música","=""pn-ranking-livro-resumo""><font face=""Verdana"">No romance &ldquo;A &uacute;ltima m&uacute;sica&rdquo;, Nicholas Sparks apresenta uma hist&oacute;ria sobre fam&iacute;lia, amizade, amor, amadurecimento e especialmente sobre como perdoar e recome&ccedil;ar. Aos dezessete anos, Ver&ocirc;nica Miller, ou simplesmente Ronnie, v&ecirc; sua vida virar de cabe&ccedil;a para baixo quando seus pais se divorciam e seu pai decide ir para a praia de Wrightsville, na Carolina do Norte. Tr&ecirc;s anos depois, ela continua magoada e distante dos pais, mas sua m&atilde;e decide que seria melhor os filhos passarem as f&eacute;rias de ver&atilde;o com o pai na Carolina do Norte. Ronnie rejeita qualquer tentativa de aproxima&ccedil;&atilde;o e amea&ccedil;a voltar para Nova York antes do ver&atilde;o acabar. &Eacute; quando ela conhece Will, o garoto mais popular da cidade. A paix&atilde;o pelo garoto abre uma nova experi&ecirc;ncia para a jovem, que vai experimentar uma felicidade nunca antes sentida.</f",0,0,"Nicholas Sparks",1,1,0,5354,1
9788563219022,"Querido John","<em>Querido John</em> (Novo Conceito, 288 pp., R$ 29,90), novo livro do autor de best-sellers que fizeram sucesso tamb&eacute;m nos cinemas, Nicholas Sparks traz agora a hist&oacute;ria de um jovem que tem que tomar a decis&atilde;o mais dif&iacute;cil de sua vida em nome de seu grande amor.&ldquo;Querido John&rdquo;, dizia a carta que partiu um cora&ccedil;&atilde;o e transformou duas vidas para sempre. Quando John Tyree conhece Savannah Lynn Curtis, descobre estar pronto para recome&ccedil;ar sua vida. Com um futuro sem grandes perspectivas, ele, um jovem rebelde, decide alistar-se no ex&eacute;rcito, ap&oacute;s concluir o ensino m&eacute;dio. Durante sua licen&ccedil;a, conhece a garota de seus sonhos, Savannah. A atra&ccedil;&atilde;o m&uacute;tua cresce rapidamente e logo se transforma em um tipo de amor que faz com que Savannah prometa esper&aacute;-lo concluir seus deveres milit",88,0,"Nicholas Sparks",1,1,1,5355,1
9788563219022,"Querido John","<em>Querido John</em> (Novo Conceito, 288 pp., R$ 29,90), novo livro do autor de best-sellers que fizeram sucesso tamb&eacute;m nos cinemas, Nicholas Sparks traz agora a hist&oacute;ria de um jovem que tem que tomar a decis&atilde;o mais dif&iacute;cil de sua vida em nome de seu grande amor.&ldquo;Querido John&rdquo;, dizia a carta que partiu um cora&ccedil;&atilde;o e transformou duas vidas para sempre. Quando John Tyree conhece Savannah Lynn Curtis, descobre estar pronto para recome&ccedil;ar sua vida. Com um futuro sem grandes perspectivas, ele, um jovem rebelde, decide alistar-se no ex&eacute;rcito, ap&oacute;s concluir o ensino m&eacute;dio. Durante sua licen&ccedil;a, conhece a garota de seus sonhos, Savannah. A atra&ccedil;&atilde;o m&uacute;tua cresce rapidamente e logo se transforma em um tipo de amor que faz com que Savannah prometa esper&aacute;-lo concluir seus deveres milit",88,0,"Nicholas Sparks",1,1,1,5356,1
9788563201102,"Elis Regina - Nada será como antes","Biografia de Elis Regina que narra a vida da cantora desde seus primeiros dias em Porto Alegre, onde interpretava “Fascinação” ao lado das amigas nas escadarias de um colégio, até sua despedida trágica, aos 36 anos, quando estava prestes a, de novo, mudar tudo em sua vida. “Não vivi a era de Elis. Quando ela faleceu, em 19 de janeiro de 1982, eu tinha nove anos de idade, e diante dessa personagem gigante, fui o que sou há 16 anos: repórter. Me joguei com o respeito que a história merecia, mas sem nenhuma tese a defender. Creio que o olhar descontaminado de paixões ou ódios ajude a traçar um perfil mais humano e menos divino”, diz Julio Maria.",24,0,"Julio Maria",1,1,0,5357,1
9788563178534,"Coaching and mentoring","O mercado atual demanda diversas características dos profissionais, entre elas a de adaptação e reinvenção diante dos desafios apresentados pela economia. Esses pontos que devem ser superados refletem no mundo corporativo e são os responsáveis pelo amadurecimento do ser humano. Para que essas transformações sejam melhor orientadas, dois métodos podem ser aplicados - o Coaching e o Mentoring.",83,0,Vários,1,1,1,5358,1
9788563066893,"Madre Teresa, CEO",NULL,36,0,"Ruma Bose",1,1,0,5359,1
9788563066756,"Investimento à prova de crise",NULL,24,0,"Marcos Silvestre",1,1,0,5360,1
9788563066299,"Dr House - Um guia para a vida",NULL,56,0,"Toni De La Torre",1,1,0,5361,1
9788563066251,"12 meses para enriquecer",NULL,88,0,"Marcos Silvestre",1,1,0,5362,1
9788563066169,"Faça como Steve Jobs e realize apresentações incríveis em qualquer situação","Cativar o público durante uma apresentação de produto é o momento crucial que define o sucesso ou o fracasso de um projeto que consumiu meses de trabalho. Por isso, empresários do mundo inteiro procuram se espelhar no CEO que mais causa admiração ao falar em público: Steve Jobs. Ao revelar o método das apresentações de Steve Jobs, Carmine Gallo mostra que não há segredos. Por meio de uma análise da estrutura das famosas palestras do líder da Apple, o autor oferece técnicas simples com as quais qualquer pessoa pode conquistar seu público, seja qual for o seu produto, transformando consumidores em defensores fiéis de suas ideias.",56,0,"Carmine Gallo",1,1,0,5363,1
9788563066138,"O efeito sombra","No interior das pessoas vive uma personalidade escondida que de vez em quando vem fazer uma visita... Beber demais, passar cheques sem fundos, comer um bolo no meio da noite ap&oacute;s tr&ecirc;s dias de dieta, visitar sites pornogr&aacute;ficos enquanto a mulher prepara o jantar... Milh&otilde;es de pessoas negam sua sombra em todo o mundo o tempo todo. Lan&ccedil;ado simultaneamente em 40 pa&iacute;ses, <em>O Efeito Sombra - Encontre o poder escondido na sua verdade</em>, de Deepak Chopra, Debbie Ford e Marianne Williamson, fala sobre este lado obscuro da alma humana: aquilo que somos, mas n&atilde;o desejamos ser e tentamos esconder dos outros e at&eacute; de n&oacute;s mesmos. A quest&atilde;o &eacute; que, quando ignorada, a sombra pode sabotar vidas, destruir rela&ccedil;&otilde;es e afastar as pessoas da realiza&ccedil;&atilde;o de seus sonhos. No livro, tr&ecirc;s dos maiores especialistas em comportamento e espiritualidade apontam caminhos para lidarmos com esse lado sombrio de nossa personalidade.",48,0,"Deepak Chopra, Debbie Ford e Marianne Williamson",1,1,0,5364,1
