BookCode,BookTitle,BookDescription,CountPage,PrintType,Authors,SalesAvailable,PublicDomain,PreviewAvaliable,idBookDimension,BookCategory
9788543106793,Recomece,"</p><p><span class=""txtDescricao"">Um caderno de perguntas que vai ajudar você a escrever sua própria história a partir do poema que conquistou o coração dos brasileiros.&nbsp; </span>Este livro é um estímulo para que você reflita sobre a sua jornada de vida, seus sentimentos mais profundos e seus relacionamentos mais especiais. Quando a vida parecer muito difícil, ponha o lápis no papel e RECOMECE novamente.</p><p>",0,0,"Bráulio Bessa",1,1,0,5511,2
9788543106618,"Dúvida cruel","<span class=""txtDescricao"">Du?vida cruel traz respostas divertidas a 80 perguntas que tiram o sono de quem sempre quer aprender algo novo sobre a vida, o universo e tudo mais.</span> Na?o importa se voce? tem 9 ou 90 anos. Se tem um espírito questionador aguc?ado, e? prova?vel que perguntas cabeludas fiquem martelando na sua cabec?a. Afinal, o mundo e? uma fonte inesgota?vel de curios",8,0,"Mariana Fulfaro / Iberê Thenório",1,1,0,5512,2
9788543105819,"Me poupe!","A partir dessas dicas, você vai aprender a dar um basta nos hábitos que sabotam sua saúde financeira, a identificar as crenças que impedem seu enriquecimento e a encontrar modalidades de investimento que caibam na sua realidade. E o melhor: vai descobrir um mundo maravilhoso em que o dinheiro trabalha para você, e não você para ele.</p><p>",76,0,"Nathalia Arcuri",1,1,0,5513,5
9788543105819,"Me poupe!","A partir dessas dicas, você vai aprender a dar um basta nos hábitos que sabotam sua saúde financeira, a identificar as crenças que impedem seu enriquecimento e a encontrar modalidades de investimento que caibam na sua realidade. E o melhor: vai descobrir um mundo maravilhoso em que o dinheiro trabalha para você, e não você para ele.</p><p>",76,0,"Nathalia Arcuri",1,1,0,5514,5
9788543105413,"Fazendo as pazes com seu corpo","Neste livro, ela revela o longo caminho que percorreu para aprender a ficar em paz com seu corpo e com a comida - os altos e baixos, o que deu certo e o que deu errado, as vezes que quis desistir e o momento em que percebeu que existia uma saída.Trazendo entrevistas com nutricionistas, psicólogos e psiquiatras, Fazendo as pazes com o corpo provoca uma necessária discussão sobre o perigo dos transtornos alimentares, o lado nocivo das redes sociais, o padrão de beleza irreal imposto pela mídia e o papel da autocompaixão no processo de cura.<br>",68,0,"Daiana Garbin",1,1,0,5515,5
9788543105338,"Marketing 4.0","Nesta obra, junto com Hermawan Kartajaya e Iwan Setiawan, Kotler examina as importantes transformações na passagem do marketing tradicional para o digital (4.0). Eles mostram não só como a conectividade alterou de forma radical o modo como vivemos, mas como entender os caminhos do consumidor na era digital e adotar um conjunto novo de métricas e práticas de marketing.",8,0,"Philip Kotler / Hermawan Kartajaya / Iwan Setiwan",1,1,0,5516,5
9788543105291,"As coisas que você só vê quando desacelera","Escrito pelo mestre zen-budista sul-coreano Haemin Sunim, As coisas que você só vê quando desacelera é um desses raros e tão necessários livros para quem deseja tranquilizar os pensamentos e cultivar a calma e a autocompaixão.",56,0,"Haemin Sunim",1,1,0,5517,5
9788543105277,"O homem mais feliz da história","O homem mais feliz da história é um romance protagonizado pelo psiquiatra Marco Polo, um pensador ateu e mundialmente reconhecido que ousa estudar a complexa mente de Jesus sob o ângulo da ciência. Em uma jornada surpreendente, ele procura desvendar os misteriosos códigos da felicidade ocultos no mais famoso discurso do Mestre dos Mestres: o Sermão da Montanha. Ao mesmo tempo que fica fascinado com suas descobertas, Marco Polo sofre uma perseguição implacável de forças ocultas que farão de tudo para silenciar sua voz.<br>",36,0,"Augusto Cury",1,1,0,5518,5
9788543105277,"O homem mais feliz da história","O homem mais feliz da história é um romance protagonizado pelo psiquiatra Marco Polo, um pensador ateu e mundialmente reconhecido que ousa estudar a complexa mente de Jesus sob o ângulo da ciência. Em uma jornada surpreendente, ele procura desvendar os misteriosos códigos da felicidade ocultos no mais famoso discurso do Mestre dos Mestres: o Sermão da Montanha. Ao mesmo tempo que fica fascinado com suas descobertas, Marco Polo sofre uma perseguição implacável de forças ocultas que farão de tudo para silenciar sua voz.<br>",36,0,"Augusto Cury",1,1,0,5519,1
9788543104379,"Todo mundo tem um anjo da guarda","Os anjos da guarda são presentes de Deus para todas as pessoas, sem exceção. Essa é a verdade que Pedro Siqueira quer transmitir para nós. Muitas vezes esquecidos, ignorados ou até desacreditados, nossos protetores ainda são um mistério para a maioria dos fiéis. Em seu novo livro, Pedro abre esse universo aos leitores. Partindo de uma visão geral das criaturas celestes, ele explica que é possível ver nossos anjos da guarda e até saber seus nomes. Além disso, mostra como podemos nos comunicar com eles para estreitar os laços com Deus. ",60,0,"Pedro Siqueira",1,1,0,5520,2
9788543104379,"Todo mundo tem um anjo da guarda","Os anjos da guarda são presentes de Deus para todas as pessoas, sem exceção. Essa é a verdade que Pedro Siqueira quer transmitir para nós. Muitas vezes esquecidos, ignorados ou até desacreditados, nossos protetores ainda são um mistério para a maioria dos fiéis. Em seu novo livro, Pedro abre esse universo aos leitores. Partindo de uma visão geral das criaturas celestes, ele explica que é possível ver nossos anjos da guarda e até saber seus nomes. Além disso, mostra como podemos nos comunicar com eles para estreitar os laços com Deus. ",60,0,"Pedro Siqueira",1,1,0,5521,2
9788543104331,"A coragem de ser imperfeito","Brené Brown ousou tocar em assuntos que costumam ser evitados por causarem grande desconforto. Sua palestra a respeito de vulnerabilidade, medo, vergonha e imperfeição já teve mais de 25 milhões de visualizações. VIver é experimentar incertezas, riscos e se expor emocionalmente. Mas isso não precisa ser ruim. Como mostra Brené Brown, a vulnerabilidade não é uma medida de fraqueza, mas a melhor definição de coragem.",8,0,"Brené Brown",1,1,0,5522,2
9788543104010,"Força para vencer","Apresentando a trajetória de dezenas de atletas, das mais variadas modalidades esportivas, o ex-piloto de Fórmula 1 Alex Dias Ribeiro compartilha as lições aprendidas por eles – muitas vezes a duras penas – na corrida pelo sucesso e pela realização pessoal. São histórias emocionantes de vitórias, derrotas, dificuldades e superação. Exemplos reais de pessoas que descobriram na fé o apoio de que precisavam para dar a volta por cima e vencer os desafios do grande jogo da vida.",40,0,"Alex Dias Ribeiro",1,1,0,5523,2
9788543103754,"Isso me traz alegria","Cheio de dicas práticas e explicações detalhadas, o livro ensina como guardar cada tipo de roupa, documento e utensílio, como arrumar armários, armazenar alimentos, organizar maquiagens, CDs e fotografias, como envolver as crianças no processo e muito mais. Respondendo às principais dúvidas dos seus clientes e leitores, Marie aborda temas que ficaram de fora do livro anterior e reafirma a etapa mais importante do seu método- descobrir, entre tudo aquilo que está à sua volta, o que realmente lhe traz alegria – e descartar o restante. Quando nos cercamos apenas de coisas que amamos, a vida flui de forma muito mais leve. A bagunça não retorna e tudo se transforma. E é aí que a mágica acontece.",72,0,"Marie Kondo",1,1,0,5524,2
9788543102429,"Oceano perdido","Em ""Oceano perdido"", Johanna Basford convida artistas de todas as idades a descobrir um mundo encantador escondido nas profundezas do mar. Ilustrações ricas em detalhes vão revelar peixes exóticos, polvos e cavalos-marinhos, abrindo um mundo de possibilidades para os amantes das cores e das tintas.<span class=""redactor-invisible-space""></span>",0,0,"Johanna Basford",1,1,0,5525,2
9788543101958,"Floresta encantada","Neste livro, Johanna Basford convida o leitor a embarcar numa viagem ao coração de uma floresta encantada. Enquanto colore os desenhos de flores, casas na árvore, animais e objetos mágicos, seu desafio é encontrar os nove símbolos especiais ocultos ao longo destas páginas. Eles destravam o portão do castelo, revelando seus mistérios. O que será que ele guarda?",4,0,"Johanna Basford",1,1,0,5526,3
9788543101958,"Floresta encantada","Neste livro, Johanna Basford convida o leitor a embarcar numa viagem ao coração de uma floresta encantada. Enquanto colore os desenhos de flores, casas na árvore, animais e objetos mágicos, seu desafio é encontrar os nove símbolos especiais ocultos ao longo destas páginas. Eles destravam o portão do castelo, revelando seus mistérios. O que será que ele guarda?",4,0,"Johanna Basford",1,1,0,5527,3
9788543101637,"Jardim secreto","Este é um livro para todas as idades, que nos permite esquecer as adversidades do dia a dia através dos desenhos e que busca trazer à tona o artista que existe em cada um de nós. Faça um passeio por estes lindos jardins e se aventure em uma caça ao tesouro tão fascinante que todos os seus problemas ficarão para trás. As ilustrações ricas em detalhes estão só esperando por você para ganhar vida.<span class=""redactor-invisible-space""> Divirta-se procurando as diversas criaturas escondidas nestas páginas. Complete os espaços em branco, escolha suas cores preferidas, faça seus próprios esboços e crie um universo deslumbrante onde não há lugar para o estresse.</span>",6,0,"Johanna Basford",1,1,0,5528,3
9788543101637,"Jardim secreto","Este é um livro para todas as idades, que nos permite esquecer as adversidades do dia a dia através dos desenhos e que busca trazer à tona o artista que existe em cada um de nós. Faça um passeio por estes lindos jardins e se aventure em uma caça ao tesouro tão fascinante que todos os seus problemas ficarão para trás. As ilustrações ricas em detalhes estão só esperando por você para ganhar vida.<span class=""redactor-invisible-space""> Divirta-se procurando as diversas criaturas escondidas nestas páginas. Complete os espaços em branco, escolha suas cores preferidas, faça seus próprios esboços e crie um universo deslumbrante onde não há lugar para o estresse.</span>",6,0,"Johanna Basford",1,1,0,5529,3
9788543101620,"Geração de valor","Desde que nascem, as pessoas são treinadas para agir de acordo com o senso comum. O ensino convencional as estimula a buscar segurança, e não liberdade. Com medo de se arriscar, a maioria segue o fluxo da boiada e sonha pequeno, optando por conseguir um emprego estável e passar anos financiando a casa própria. Flávio Augusto, porém, conseguiu sair da conformidade bem cedo. De uma família simples da periferia do Rio de Janeiro, aos 23 anos, escolheu o caminho do empreendedorismo, criou uma escola de inglês que deu origem à bem-sucedida rede Wise Up e logo se tornou um dos mais jovens bilionários brasileiros. Indignado com o modelo imposto pelo senso comum, Flávio resolveu arregaçar as mangas e mostrar às pessoas que é possível pensar de forma diferente. Para difundir sua mentalidade vitoriosa, criou o projeto Geração de Valor e começou a compartilhar seus conhecimentos no Facebook, no YouTube, no Twitter e em um blog, inspirando milhões de pessoas.",8,0,"Flávio Augusto da Silva",1,1,0,5530,3
9788543101620,"Geração de valor","Desde que nascem, as pessoas são treinadas para agir de acordo com o senso comum. O ensino convencional as estimula a buscar segurança, e não liberdade. Com medo de se arriscar, a maioria segue o fluxo da boiada e sonha pequeno, optando por conseguir um emprego estável e passar anos financiando a casa própria. Flávio Augusto, porém, conseguiu sair da conformidade bem cedo. De uma família simples da periferia do Rio de Janeiro, aos 23 anos, escolheu o caminho do empreendedorismo, criou uma escola de inglês que deu origem à bem-sucedida rede Wise Up e logo se tornou um dos mais jovens bilionários brasileiros. Indignado com o modelo imposto pelo senso comum, Flávio resolveu arregaçar as mangas e mostrar às pessoas que é possível pensar de forma diferente. Para difundir sua mentalidade vitoriosa, criou o projeto Geração de Valor e começou a compartilhar seus conhecimentos no Facebook, no YouTube, no Twitter e em um blog, inspirando milhões de pessoas.",8,0,"Flávio Augusto da Silva",1,1,0,5531,5
9788543101439,"Casais inteligentes enriquecem juntos","Uma das maiores causas de brigas entre os casais são as dificuldades financeiras. Se falta dinheiro para pagar as contas, a culpa recai sobre o parceiro esbanjador, que não quer nem saber se tem saldo no banco na hora de fazer uma compra. Se sobra dinheiro no fim do mês, em vez de comemorar, o casal pode se desentender sobre como investir ou gastar aquela quantia. De acordo com o consultor Gustavo Cerbasi, a raiz do problema está na falta de conversa sobre dinheiro. Em geral, só se fala sobre o assunto quando a bomba já estourou. E por não discutir a questão a dois, a maioria acaba deixando de fazer um orçamento realista, de guardar dinheiro para atingir suas metas e de se planejar para manter um bom padrão de vida no futuro. Com sugestões válidas para qualquer fase do relacionamento, desde o namoro até as bodas de ouro, <em>Casais inteligentes enriquecem juntos</em> aponta diferentes estratégias para formar uma parceria inteligente na administração das finanças da família. Ele traz também testes que avaliam a capacidade do casal de construir riqueza.",76,0,"Gustavo Cerbasi",1,1,0,5532,5
9788543101385,"O que eu sei de verdade",NULL,92,0,"Oprah Winfrey",1,1,0,5533,5
9788543101279,"De volta ao mosteiro","Neste livro, James Hunter retoma a história do monge e do executivo dois anos depois do retiro onde se conheceram. Eles se reúnem com os outros cinco participantes do primeiro seminário em busca de uma compreensão mais profunda sobre a formação de grandes líderes. O reencontro traz à tona uma dura constatação: só um dos integrantes do retiro anterior conseguiu colocar em prática os poderosos princípios aprendidos. Enquanto revela as razões para isso, Hunter nos convida a refletir sobre nosso comportamento. Será que estamos agindo como verdadeiros líderes em casa, no trabalho e com os amigos?",92,0,"James Hunter",1,1,0,5534,5
9788543101279,"De volta ao mosteiro","Neste livro, James Hunter retoma a história do monge e do executivo dois anos depois do retiro onde se conheceram. Eles se reúnem com os outros cinco participantes do primeiro seminário em busca de uma compreensão mais profunda sobre a formação de grandes líderes. O reencontro traz à tona uma dura constatação: só um dos integrantes do retiro anterior conseguiu colocar em prática os poderosos princípios aprendidos. Enquanto revela as razões para isso, Hunter nos convida a refletir sobre nosso comportamento. Será que estamos agindo como verdadeiros líderes em casa, no trabalho e com os amigos?",92,0,"James Hunter",1,1,0,5535,5
9788543100975,"Adeus, aposentadoria",NULL,60,0,"Gustavo Cerbasi",1,1,0,5536,5
9788543100456,Adultério,NULL,40,0,"Paulo Coelho",1,1,0,5537,1
9788543100456,Adultério,NULL,40,0,"Paulo Coelho",1,1,0,5538,1
9788543100425,"Você pode falar com Deus",NULL,44,0,"Pedro Siqueira",1,1,0,5539,1
9788542806021,"O livro dos cinco anéis","Na arte militar,igualmente, durante um combate, é essencial vencer os momentos críticos, conhecendo a capacidade do adversário e utilizando corretamente a própria competência. dessa forma, apoiado em seus conhecimentos e em seus prícipios - tal como um bom navegante supera sua rota marítima -, alcaçará a tranquilidade de espírito, atravessando as correntes críticas. Do domínio de sua armaou do seu ofício, o homem chega ao domínio de si e, em consequência, á vitório nas mais diversas situações. Este é um livro de cabeceira, agora em edição especial, para quem ambiciona vencer.Nos negócios e na vida.",58,0,"Miyamoto Musashi",1,1,0,5540,1
9788542806007,"Box - O essencial da estratégia","“O Essencial da Estratégia” é um box com três títulos famosos em todo o mundo e, que se complementam, sendo indispensáveis para qualquer pessoa que queira sair do lugar comum e se destacar na vida. São eles: 'A Arte da Guerra', de Sun Tzu, 'O Príncipe' de Nicolau Maquiavel e O Livro dos Cinco Anéis de Miyamoto Musashi reunidas em um luxuoso kit.<br>",96,0,"Miyamoto Musashi/ Sun Tzu / Nicolau Maquiavel",1,1,0,5541,1
9788542804126,"Guerra civil","Homem de Ferro e Capitão América - dois membros essenciais para os Vingadores, a maior equipe de super-heróis do mundo. Quando uma trágica batalha deixa um buraco na cidade de Stamford, matando centenas de pessoas, o governo americano exige que todos os super-heróis revelem sua identidade e registrem seus poderes. Para Tony Stark - o Homem de Ferro - é um passo lamentável, porém necessário, o que o leva a apoiar a lei. Para o Capitão América, é uma intolerável agressão à liberdade cívica. Assim começa a Guerra Civil.",98,0,"Stuart Moore",1,1,0,5542,1
9788542801842,"A única coisa",NULL,8,0,"Gary Keller / Jay Papasan",1,1,0,5543,1
9788542215496,"Por onde for o teu passo, que lá esteja o teu coração","<span class=""txtDescricao"">""Há caminhos que não podemos andar acompanhados. E este é um deles: o que nos leva ao dentro de nós. Ande pelo seu. Ofereça-se à compaixão, o que de mais nobre você pode se proporcionar. É sob a sua tutela amorosa que você descobrirá que a vida pode ser diferente, e que nunca é tarde para reorientar a sua história. Ouça o que você tem a se dizer. Recolha-se com este livro nas mãos. Nele há um itinerário para os que pretendem renascer. Aceite este convite. Não espere que o outro lhe dê aquilo que só você pode se oferecer.” – Pe. Fábio de Melo</span>",32,0,"Pe. Fábio de Melo",1,1,0,5544,1
9788542215250,"Demos graças a Deus","<span class=""txtDescricao"">Padre Marcos Rogério nos ensina em seu novo livro a viver a gratidão para sermos diariamente mais feliz. A vida apresenta momentos de tristeza, frustração e complicação, mas o que determina o nosso estado de espírito é como lidaremos com cada um deles. Aqui será possível aprender a ser grato e entender como vencer situações de solidão, decepções, dúvidas, perdas familiares, morte entre muitos outros desafios.&nbsp;Aprenda a encarar todos eles com amor e principalmente gratidão, diariamente, lembrando sempre que se há amor ainda vale a pena tentar e agradecer.</span>",28,0,"Pe. Marcos Rogério",1,1,0,5545,1
9788542214970,"O melhor do Cortella","<span class=""txtDescricao"">Um dos mais populares intelectuais brasileiros, Mario Sergio Cortella está completando 30 anos da publicação de seu primeiro livro – Descartes: A paixão pela razão. Grande frasista e dono de uma enorme capacidade de síntese, Cortella coleciona ideias e pensamentos nos quase 40 livros que publicou. Essa trilogia da Planeta apresenta as melhores frases de Cortella divididas por temas. O primeiro volume apresenta ideias sobre filosofia, política, religião, ciências e artes.</span>",44,0,"Mario Sergio Cortella",1,1,0,5546,1
9788542214369,"O dilema do porco-espinho","Em O dilema do porco-espinho, Karnal viaja pela modernidade líquida e analisa a solidão no mundo virtual e o isolamento. Discute dos amigos imaginários criados pelas crianças aos pensamentos de alguns filósofos, como Aristóteles, que dizia que a solidão criava deuses e bestas.&nbsp;",92,0,"Leandro Karnal",1,1,0,5547,1
9788542214369,"O dilema do porco-espinho","Em O dilema do porco-espinho, Karnal viaja pela modernidade líquida e analisa a solidão no mundo virtual e o isolamento. Discute dos amigos imaginários criados pelas crianças aos pensamentos de alguns filósofos, como Aristóteles, que dizia que a solidão criava deuses e bestas.&nbsp;",92,0,"Leandro Karnal",1,1,0,5548,3
9788542213973,"Descubra o seu destino","Tiago Brunet, a partir de sua experiência como coaching, apresenta neste livro ferramentas para que você atinja seus objetivos de uma vez por todas. Não importa o tamanho da sua meta. A ideia é que seja possível atingí-la. Sem atalhos, sem confusões, mas com foco, objetividade e motivação. O primeiro passo é descobrir onde você está. O próximo, é correr para o alvo.",92,0,"Tiago Brunet",1,1,0,5549,2
9788542213973,"Descubra o seu destino","Tiago Brunet, a partir de sua experiência como coaching, apresenta neste livro ferramentas para que você atinja seus objetivos de uma vez por todas. Não importa o tamanho da sua meta. A ideia é que seja possível atingí-la. Sem atalhos, sem confusões, mas com foco, objetividade e motivação. O primeiro passo é descobrir onde você está. O próximo, é correr para o alvo.",92,0,"Tiago Brunet",1,1,0,5550,2
9788542213683,"Pai de menina","Neste livro, Marcos Mion conta sua trajetória como pai da Donatela, a Doninha. Mas mais do que isso, ele constrói um verdadeiro guia para a irmandade dos pais de menina. Além de dar soluções e respostas para as perguntas acima, ele apresentará formas de se aproximar de sua filha, práticas corriqueiras para ter mais contato com ela e principalmente pequenos gestos, atitudes e falas que podem passar despercebidos para alguns, mas que serão a chave para você ser um bom pai todos os dias.",16,0,"Marcos Mion",1,1,0,5551,2
9788542213065,"Shinsetsu : o poder da gentileza","Um dos palestrantes mais requisitados do Brasil, o professor Clóvis de Barros Filho escreveu um livro onde ele conversa com o leitor e, sem que este perceba, ensina o que, de fato, é importante nesta vida. Poderia ser considerado como uma versão brasileira do clássico O mundo de Sofia, romance que conta a história da filosofia. Clóvis usa três personagens: a aluna japonesa Shinsetsu, sua amiga italiana Moral e a professora britânica Mrs. Utilility. É através delas que lembramos que está na hora de pararmos de pensar só em nós mesmos.",72,0,"Clovis de Barros Filho",1,1,0,5552,2
9788542212990,"Seja o amor da sua vida","Eu sei por que você está aqui lendo este livro e levantando os olhos enquanto se pergunta mentalmente: “como ele sabe?”. EU sei porque, de alguma maneira, as pessoas se atraem. E, por alguma razão, que não saberei explicar, este livro será importante para você. O meu desejo é iniciar um processo: não vai ser o livro que vai te ajudar a encontrar o amor da sua vida, mas o modo como você prestar atenção nos detalhes fará toda a diferença. ELe não é responsável por te salvar, assim como ninguém na sua vida é. APENAS VOCÊ MESMO!<br>",24,0,"Guilherme Pintto",1,1,0,5553,2
9788542212716,"Gente de resultados","“Como contratar, preparar, motivar e liderar profissionais de alto rendimento, sem ser especialista no assunto?” Para responder a essa pergunta fundamental, o autor, baseado em mais de 30 anos de experiência em consultorias e treinamentos, preparou um manual prático para gestores que gostariam de obter excelentes resultados em sua atividade profissional, e mostra, de forma objetiva, como formar equipes compactas de altíssimo potencial.<br>",8,0,"Eduardo Ferraz",1,1,0,5554,2
9788542212389,"Zen para distraídos","Zen para distraídos aplica conceitos do budismo para melhorar o nosso bem-estar. A partir de práticas de meditação, de conceitos básicos do zen e outras técnicas milenares será possível manter o foco, desenvolver tarefas simples com muito mais concentração, ser mais assertivo, atingir objetivos e muito mais.",24,0,"Monja Coen / Nilo Cruz",1,1,0,5555,2
9788542212341,"A sorte segue a coragem!","Todo mundo já usou algumas dessas justificativas para o insucesso: ""Eu tento, tento e não funciona""; ""não tenho sorte""; ""não dou pro negócio""; ""por mais que eu ande, não saio do lugar""; ""não fico fazendo marketing pessoal"". Em A sorte segue a coragem! Oportunidades, competências e tempos de vida, o professor Mario Sergio Cortella afirma que não se pode atribuir o sucesso ou o fracasso somente a forças externas ao indivíduo. Em vinte capítulos, o autor de Por que fazemos o que fazemos?, um dos maiores best-sellers brasileiros dos últimos anos, discute comportamentos comuns a todos e aponta caminhos para que cada um cultive a própria sorte. Confira os tópicos abordados neste livro.",92,0,"Mario Sergio Cortella",1,1,0,5556,2
9788542212341,"A sorte segue a coragem!","Todo mundo já usou algumas dessas justificativas para o insucesso: ""Eu tento, tento e não funciona""; ""não tenho sorte""; ""não dou pro negócio""; ""por mais que eu ande, não saio do lugar""; ""não fico fazendo marketing pessoal"". Em A sorte segue a coragem! Oportunidades, competências e tempos de vida, o professor Mario Sergio Cortella afirma que não se pode atribuir o sucesso ou o fracasso somente a forças externas ao indivíduo. Em vinte capítulos, o autor de Por que fazemos o que fazemos?, um dos maiores best-sellers brasileiros dos últimos anos, discute comportamentos comuns a todos e aponta caminhos para que cada um cultive a própria sorte. Confira os tópicos abordados neste livro.",92,0,"Mario Sergio Cortella",1,1,0,5557,3
